{
    "$schema": "http://json-schema.org/draft-07/schema#",
    "type": "object",
    "properties": {
      "status": {
        "type": "object",
        "properties": {
          "noOfQueries": {
            "type": "integer"
          },
          "inlineCompletions": {
            "type": "integer"
          },
          "overallQuality": {
            "type": "integer"
          },
          "required": ["noOfQueries", "inlineCompletions", "overallQuality"]
        }
      },
      "inlineSuggestion": {
        "type": "array",
        "items": {
          "type": "object",
          "properties": {
            "lineNumber": {
              "type": "integer"
            },
            "text": {
              "type": "string"
            }
          },
          "required": ["lineNumber", "text"]
        }
      },
      "checkStyle": {
        "type": "object",
        "properties": {
          "checkboxes": {
            "type": "array",
            "items": {
              "type": "boolean"
            }
          },
          "occuranceLineNumbers": {
            "type": "array",
            "items": {
              "type": "array",
              "items": {
                "type": "integer"
              }
            }
          },
          "Score": {
            "type": "integer"
          }
        },
        "required": ["checkboxes", "occuranceLineNumbers", "Score"]
      },
      "summary": {
        "type": "object",
        "properties": {
          "strength": {
            "type": "string"
          },
          "scopeForImprovement": {
            "type": "string"
          }
        },
        "required": ["strength", "scopeForImprovement"]
      }
    },
    "required": ["status", "inlineSuggestion", "checkStyle", "summary"]
  }
  